{
  "ccis_object": "ccis.evidence_bundle",
  "schema_version": 1,
  "bundle_id": "bundle_contracts_transition_4",
  "task_id": "task_ccis_contracts",
  "transition_id": "transition_contracts_gated_accepted",
  "created_at": "2026-08-03T08:14:00Z",
  "artifacts": {
    "task": {"path": "task.json", "sha256": "sha256:0101010101010101010101010101010101010101010101010101010101010101"},
    "objective": {"path": "objective.json", "sha256": "sha256:0202020202020202020202020202020202020202020202020202020202020202"},
    "candidates": {"path": "candidates.json", "sha256": "sha256:0303030303030303030303030303030303030303030303030303030303030303"},
    "roundtable_record": {"path": "roundtable-record.json", "sha256": "sha256:0404040404040404040404040404040404040404040404040404040404040404"},
    "plan": {"path": "plan.json", "sha256": "sha256:0505050505050505050505050505050505050505050505050505050505050505"},
    "workspace_manifest": {"path": "workspace-manifest.json", "sha256": "sha256:0606060606060606060606060606060606060606060606060606060606060606"},
    "before_hash": {"path": "before-hash.json", "sha256": "sha256:0707070707070707070707070707070707070707070707070707070707070707"},
    "after_hash": {"path": "after-hash.json", "sha256": "sha256:0808080808080808080808080808080808080808080808080808080808080808"},
    "candidate_diff": {"path": "candidate.diff", "sha256": "sha256:0909090909090909090909090909090909090909090909090909090909090909"},
    "commands": {"path": "commands.jsonl", "sha256": "sha256:1010101010101010101010101010101010101010101010101010101010101010"},
    "stdout": {"path": "stdout.log", "sha256": "sha256:1111111111111111111111111111111111111111111111111111111111111111"},
    "stderr": {"path": "stderr.log", "sha256": "sha256:1212121212121212121212121212121212121212121212121212121212121212"},
    "test_results": {"path": "test-results.json", "sha256": "sha256:1313131313131313131313131313131313131313131313131313131313131313"},
    "lint_results": {"path": "lint-results.json", "sha256": "sha256:1414141414141414141414141414141414141414141414141414141414141414"},
    "evaluation": {"path": "evaluation.json", "sha256": "sha256:1515151515151515151515151515151515151515151515151515151515151515"},
    "review": {"path": "review.json", "sha256": "sha256:1616161616161616161616161616161616161616161616161616161616161616"},
    "decision": {"path": "decision.json", "sha256": "sha256:1717171717171717171717171717171717171717171717171717171717171717"},
    "result": {"path": "result.json", "sha256": "sha256:1818181818181818181818181818181818181818181818181818181818181818"}
  },
  "bundle_hash": "sha256:cccccccccccccccccccccccccccccccccccccccccccccccccccccccccccccccc"
}
